{
  "$defs": {
    "actor": {
      "additionalProperties": false,
      "properties": {
        "actorId": {
          "minLength": 1,
          "type": "string"
        },
        "actorType": {
          "enum": [
            "human",
            "agent",
            "kernel"
          ]
        }
      },
      "required": [
        "actorType",
        "actorId"
      ],
      "type": "object"
    },
    "exclusionRef": {
      "additionalProperties": false,
      "properties": {
        "$exclusion": {
          "$ref": "#/$defs/id"
        }
      },
      "required": [
        "$exclusion"
      ],
      "type": "object"
    },
    "gapRef": {
      "additionalProperties": false,
      "properties": {
        "$gap": {
          "$ref": "#/$defs/id"
        }
      },
      "required": [
        "$gap"
      ],
      "type": "object"
    },
    "id": {
      "pattern": "^[a-z0-9][a-z0-9._:-]*$",
      "type": "string"
    },
    "provenance": {
      "additionalProperties": false,
      "properties": {
        "extractedAt": {
          "type": "string"
        },
        "extractor": {
          "type": "string"
        },
        "locator": {
          "type": "string"
        },
        "sourceArtifact": {
          "type": "string"
        }
      },
      "required": [
        "sourceArtifact",
        "locator",
        "extractor",
        "extractedAt"
      ],
      "type": "object"
    },
    "timestamp": {
      "pattern": "^\\d{4}-\\d{2}-\\d{2}(T\\d{2}:\\d{2}:\\d{2}(\\.\\d+)?Z)?$",
      "type": "string"
    }
  },
  "$id": "https://docket.offgriddevices.com/schema/EvaluationRun.schema.json",
  "$schema": "https://json-schema.org/draft/2020-12/schema",
  "additionalProperties": false,
  "description": "Immutable, sealed, kernel-only.",
  "properties": {
    "confidence": {
      "enum": [
        "explicit",
        "inferred",
        "absent"
      ]
    },
    "createdAt": {
      "$ref": "#/$defs/timestamp"
    },
    "createdBy": {
      "$ref": "#/$defs/actor"
    },
    "evaluator": {
      "$ref": "#/$defs/id"
    },
    "evaluatorVersion": {
      "type": "string"
    },
    "id": {
      "$ref": "#/$defs/id"
    },
    "ingestionProvenance": {
      "$ref": "#/$defs/provenance"
    },
    "inputsHash": {
      "type": "string"
    },
    "kernelVersion": {
      "type": "string"
    },
    "method": {
      "type": "string"
    },
    "outputHashes": {
      "items": {
        "type": "string"
      },
      "type": "array"
    },
    "outputs": {
      "items": {
        "$ref": "#/$defs/id"
      },
      "type": "array"
    },
    "parameterBindings": {
      "additionalProperties": true,
      "type": "object"
    },
    "plan": {
      "$ref": "#/$defs/id"
    },
    "ranking": {
      "items": {
        "$ref": "#/$defs/id"
      },
      "type": "array"
    },
    "rev": {
      "minimum": 1,
      "type": "integer"
    },
    "runRecordHash": {
      "type": "string"
    },
    "sealedAt": {
      "type": "string"
    },
    "sealedBy": {
      "const": "kernel"
    },
    "seed": {
      "type": "integer"
    },
    "step": {
      "type": "string"
    },
    "supersedes": {
      "$ref": "#/$defs/id"
    },
    "type": {
      "const": "EvaluationRun"
    }
  },
  "required": [
    "id",
    "type",
    "rev",
    "createdBy",
    "createdAt",
    "plan",
    "step",
    "evaluator",
    "evaluatorVersion",
    "method",
    "inputsHash",
    "parameterBindings",
    "seed",
    "kernelVersion",
    "outputs",
    "outputHashes",
    "ranking",
    "sealedAt",
    "sealedBy",
    "runRecordHash"
  ],
  "title": "EvaluationRun",
  "type": "object"
}
