{
  "createdAt": "2013-04-30T00:00:00Z",
  "createdBy": {
    "actorId": "docket-kernel/0.1.0",
    "actorType": "kernel"
  },
  "evaluator": "mdl-cbo-metric",
  "evaluatorVersion": "0.1.0",
  "id": "run-pl-cbo-primary",
  "inputsHash": "eb85a5ce4f7d4e67b29a201f9134d9ee571ac222c43a43d7ba77dde3716e0e3c",
  "kernelVersion": "0.1.0",
  "method": "mavt",
  "outputHashes": [
    "db9a15df960bd090d8374ce7d6bda8c6453ddf8366d425c048b7e6097a1b35f7",
    "85a0e1beb83b736fb2c40a25e82a6298437bdbb5968cfae2088ae6b9a863aafd",
    "ddefe4c59718d353582d0e923cd5a7d1c126ad9da79da12ec870f56a4ed9e653",
    "9a8d4ad995ba9ac9fa17e9570cce0c4d6aa526e81d6488476a4baf41de62314d",
    "a4f7764ce83b23e61a0d19a8b1bf451e45cbbf5869465caee71a4e5502234c78",
    "491f66952e66a5fa65c07b93303f6ca102b1040fbc56053752dae9a9d4402062",
    "dc6924ae30d3064ebe011af92f27e77b45562db317ae0cb5078f36b57f1fb882",
    "ae984c4120d22a447022885a36343466891286e495cc52e17e57c4424000d7eb",
    "45a3e4b0d3c51fded355c7163d9885fe01dd2ebd2c5c0d6587c1fbb6faedc6b1",
    "2e869cbf5242905071e9ad4ac03c9ff688c6dab76f76364b117c7cabee935a43",
    "32ad49a94eb13582ae9d909604f9750f95a462ffb0fb35ab4b5da3474caf629b",
    "551f4459f8da0047a4ece6cdb807206746cc35ff86f2232479a1338310313d39",
    "f64a75b8bfb5ccdeba1bf42fc1c94c16c6d4c9be7c032b6d17423b00da3aa174",
    "49332d5eeab41948ffd90f797b4a9520ec4eddd708856514e3e2a70c8c54c59a",
    "0e564a168f67b50d582f8bf0593d8ff3abc33eed7400c0107d85baf48f4593ae",
    "9974394c760868ec43e9d8735cd1aee04e19c111a484022d6096deb0f9e0e7ad",
    "b9c6939142027fe258f6736c1cbedd50efb4671e53869f815454bf6192d16258",
    "d8eb1837733ffc3454a35992a99801599952ab9d9e16cd5970b4bb3c5aa84cbd",
    "045dfdddcae4f33187daabeb94e62c530d5a7116a08c0239040468346934c750",
    "6800e3974c71029d5f4a86c77dead6552543b67a02526ddddfee5f7bba11352a",
    "9b98e07baff6ee09d975916bd568ba2148465ac36d317fbe28ca1073863dbb69",
    "378a50c8687ed5e590f13d259811cf48c125ab674503e145fa35ce38e815e165",
    "75b5e78f84a80bf90015a27fd80aef4dc68041024aa56366f0f6bce286e98621",
    "227c8eeb1233af5674923c200845b7188288d578dca0517e242776bc0267f5e9",
    "2a10f7f14812fbec0b529d3fef14c40ec367f654d2d5044c40c6d56bf127e87c"
  ],
  "outputs": [
    "res-run-pl-cbo-primary-alt-gcv-m-leth",
    "res-run-pl-cbo-primary-alt-gcv-m-mob",
    "res-run-pl-cbo-primary-alt-gcv-m-pax",
    "res-run-pl-cbo-primary-alt-gcv-m-prot",
    "res-run-pl-cbo-primary-alt-gcv",
    "res-run-pl-cbo-primary-alt-namer-m-leth",
    "res-run-pl-cbo-primary-alt-namer-m-mob",
    "res-run-pl-cbo-primary-alt-namer-m-pax",
    "res-run-pl-cbo-primary-alt-namer-m-prot",
    "res-run-pl-cbo-primary-alt-namer",
    "res-run-pl-cbo-primary-alt-puma-m-leth",
    "res-run-pl-cbo-primary-alt-puma-m-mob",
    "res-run-pl-cbo-primary-alt-puma-m-pax",
    "res-run-pl-cbo-primary-alt-puma-m-prot",
    "res-run-pl-cbo-primary-alt-puma",
    "res-run-pl-cbo-primary-alt-retain-bradley-m-leth",
    "res-run-pl-cbo-primary-alt-retain-bradley-m-mob",
    "res-run-pl-cbo-primary-alt-retain-bradley-m-pax",
    "res-run-pl-cbo-primary-alt-retain-bradley-m-prot",
    "res-run-pl-cbo-primary-alt-retain-bradley",
    "res-run-pl-cbo-primary-alt-upgraded-bradley-m-leth",
    "res-run-pl-cbo-primary-alt-upgraded-bradley-m-mob",
    "res-run-pl-cbo-primary-alt-upgraded-bradley-m-pax",
    "res-run-pl-cbo-primary-alt-upgraded-bradley-m-prot",
    "res-run-pl-cbo-primary-alt-upgraded-bradley"
  ],
  "parameterBindings": {
    "observationIds": [
      "ob-gcv-leth",
      "ob-gcv-mob",
      "ob-gcv-pax",
      "ob-gcv-prot",
      "ob-namer-leth",
      "ob-namer-mob",
      "ob-namer-pax",
      "ob-namer-prot",
      "ob-puma-leth",
      "ob-puma-mob",
      "ob-puma-pax",
      "ob-puma-prot",
      "ob-retain-bradley-leth",
      "ob-retain-bradley-mob",
      "ob-retain-bradley-pax",
      "ob-retain-bradley-prot",
      "ob-upgraded-bradley-leth",
      "ob-upgraded-bradley-mob",
      "ob-upgraded-bradley-pax",
      "ob-upgraded-bradley-prot"
    ],
    "weightSet": "ws-primary",
    "weights": {
      "m-leth": 0.3,
      "m-mob": 0.2,
      "m-pax": 0.1,
      "m-prot": 0.4
    }
  },
  "plan": "pl-cbo",
  "ranking": [
    "alt-puma",
    "alt-upgraded-bradley",
    "alt-gcv",
    "alt-namer",
    "alt-retain-bradley"
  ],
  "rev": 1,
  "runRecordHash": "23ce6f15390e607802004b9319bafcf1c040a19de6e0f0970e6272c7e677a97c",
  "sealedAt": "2013-04-30T00:00:00Z",
  "sealedBy": "kernel",
  "seed": 20130430,
  "step": "primary",
  "type": "EvaluationRun"
}
